Symbol,Company Name
GWX,SPDR S&P International SmallCap ETF
GXC,SPDR S&P China ETF
GXF,Global X FTSE Nordic Region ETF
GXG,Global X MSCI Colombia ETF
GXP,Great Plains Energy Incorporated Common Stock
GXP$A,Great Plains Energy Incorporated Preferred Stock
GXP$D,Great Plains Energy Incorporated Preferred Stock
GXP$E,Great Plains Energy Incorporated Preferred Stock
GY,GenCorp Inc. Common Stock
GYB,CABCO Series 2004
GYC,Corporate Asset Backed Corp CABCO Corporate Asset Backed Corporation CABCO Series 2004
GYEN,AdvisorShares Gartman Gold/Yen ETF
GYLD,Arrow Dow Jones Global Yield ETF ETF
GZT,Gazit
H,Hyatt Hotels Corporation Class A Common Stock
HACK,PureFunds ISE Cyber Security ETF
HAE,Haemonetics Corporation Common Stock
HAL,Halliburton Company Common Stock
HAO,Guggenheim China Small Cap Index ETF
HAP,Market Vectors Natural Resources ETF
HAR,"Harman International Industries, Incorporated Common Stock"
HASI,"Hannon Armstrong Sustainable Infrastructure Capital, Inc. Common Stock"
HBI,Hanesbrands Inc. Common Stock
HBM,Hudbay Minerals Inc Ordinary Shares (Canada)
HBM.W,HudBay Minerals Inc Warrants Expiring 07/20/2018 (Canada)
HCA,"HCA Holdings, Inc. Common Stock"
HCC,"HCC Insurance Holdings, Inc. Common Stock"
HCHC,"HC2 Holdings, Inc. Common Stock"
HCI,"HCI Group, Inc. Common Stock"
HCJ,"HCI Group, Inc. 8% Senior Notes due 2020"
HCLP,Hi
HCN,"Health Care REIT, Inc. Common Stock"
HCN$I,"Health Care REIT, Inc. PFD PERPETUAL CONV SER I"
HCN$J,HEALTH CARE REIT INC Preferred Stock 6.5% PFD SERIES J
HCP,"HCP, Inc. Common Stock"
HD,"Home Depot, Inc. (The) Common Stock"
HDB,HDFC Bank Limited Common Stock
HDG,ProShares Hedge Replication ETF
HDGE,Ranger Equity Bear Bear ETF
HDGI,AdvisorShares Athena International Bear ETF
HDLV,"ETRACS Montly Pay 2xLeveraged US High Dividend Low Volatility ETN due September 30, 2044"
HDV,iShares Core High Dividend ETF
HDY,HyperDynamics Corporation Common Stock
HE,"Hawaiian Electric Industries, Inc. Common Stock"
HE$U,"Hawaiian Electric Industries, Inc. 6.5 % Cum QUIPS"
HEB,"Hemispherx BioPharma, Inc. Common Stock"
HECO,Huntington EcoLogical Strategy ETF
HEDJ,WisdomTree Europe Hedged Equity Fund
HEEM,iShares Currency Hedged MSCI Emerging Markets ETF
HEFA,iShares Currency Hedged MSCI EAFE ETF
HEI,Heico Corporation Common Stock
HEI.A,Heico Corporation Common Stock
HELI,CHC Group Ltd. Ordinary Shares
HEP,"Holly Energy Partners, L.P. Common Stock"
HEQ,John Hancock Hedged Equity & Income Fund Common Shares of Beneficial Interest
HES,Hess Corporation Common Stock
HEVY,iPath Pure Beta Industrial Metals ETN
HEWG,iShares Currency Hedged MSCI Germany ETF
HEWJ,iShares Currency Hedged MSCI Japan ETF
HEZU,iShares Trust iShares Currency Hedged MSCI EMU ETF
HF,"HFF, Inc. Common Stock, Class A"
HFC,HollyFrontier Corporation Common Stock
HFIN,Horizons S&P Financial Select Sector Covered Call ETF
HGG,"HHGregg, Inc. Common Stock"
HGH,"Hartford Financial Services Group, Inc. (The) 7.875% Fixed to Floating Rate Junior Subordinated Debentures due 2042"
HGI,Guggenheim International Multi
HGR,"Hanger, Inc. Common Stock ($0.01 Par Value)"
HGT,Hugoton Royalty Trust Common Stock
HH,"Hooper Holmes, Inc. Common Stock"
HHC,Howard Hughes Corporation (The) Common Stock
HHS,Harte
HHY,Brookfield High Income Fund Inc.
HI,Hillenbrand Inc Common Stock
HIE,Miller/Howard High Income Equity Fund Common Shares of Beneficial Interest
HIG,"Hartford Financial Services Group, Inc. (The) Common Stock"
HIG.W,"Hartford Financial Services Group, Inc. (The) Warrants expiring June 26, 2019"
HII,"Huntington Ingalls Industries, Inc. Common Stock"
HIL,"Hill International, Inc. Common Stock"
HILO,EGShares Low Volatility Emerging Markets Dividend ETF
HIO,"Western Asset High Income Opportunity Fund, Inc. Common Stock"
HIPS,Master Income ETF
HIVE,"Aerohive Networks, Inc. Common Stock"
HIW,"Highwoods Properties, Inc. Common Stock"
HIX,Western Asset High Income Fund II Inc. Common Stock
HJV,"MS Structured Asset Corp MS Structured Asset Corp. SATURNS J.C. Penney Company, Inc. Debenture Backed Series 2007"
HK,Halcon Resources Corporation Common Stock
HKOR,Horizons Korea KOSPI 200 ETF
HL,Hecla Mining Company Common Stock
HL$B,Hecla Mining Company Preferred Stock
HLF,Herbalife Ltd. Common Stock
HLM$,Hillman Group Capital Trust Preferred Stock
HLS,HealthSouth Corporation Common Stock
HLT,Hilton Worldwide Holdings Inc. Common Stock
HLX,"Helix Energy Solutions Group, Inc. Common Stock"
HMC,"Honda Motor Company, Ltd. Common Stock"
HME,"Home Properties, Inc. Common Stock"
HMG,"HMG/Courtland Properties, Inc. Common Stock"
HMLP,Hoegh LNG Partners LP Common Units representing Limited Partner Interests
HMN,Horace Mann Educators Corporation Common Stock
HMY,Harmony Gold Mining Company Limited
HNI,HNI Corporation Common Stock
HNP,Huaneng Power Intl Common Stock
HNR,Harvest Natural Resources Inc
HNT,Health Net Inc. Common Stock
HNW,Pioneer Diversified High Income Trust Pioneer Diversified High Income Trust Common Shares of Beneficial Interest
HOG,Harley
HOLD,AdvisorShares Sage Core Reserves ETF
HON,Honeywell International Inc. Common Stock
HOS,Hornbeck Offshore Services Common Stock
HOT,"Starwood Hotels & Resorts Worldwide, Inc. Common Stock"
HOV,"Hovnanian Enterprises, Inc. Class A Common Stock"
HP,"Helmerich & Payne, Inc. Common Stock"
HPF,John Hancock Pfd Income Fund II Pfd Income Fund II
HPI,John Hancock Preferred Income Fund Common Shares of Beneficial Interest
HPP,"Hudson Pacific Properties, Inc. Common Stock"
HPP$B,"Hudson Pacific Properties, Inc. 8.375% Series B Cumulative Redeemable Preferred shares"
HPQ,Hewlett
HPS,John Hancock Preferred Income Fund III Preferred Income Fund III
HPT,Hospitality Properites Trust Common Stock
HPT$D,Hospitality Properties Trust Preferred Stock
HPY,"Heartland Payment Systems, Inc. Common Stock"
HQH,Tekla Healthcare Investors Common Stock
HQL,TeklaLife Sciences Investors Common Stock
HR,Healthcare Realty Trust Incorporated Common Stock
HRB,"H&R Block, Inc. Common Stock"
HRC,Hill
HRG,Harbinger Group Inc Common Stock
HRL,Hormel Foods Corporation Common Stock
HRS,Harris Corporation Common Stock
HRT,Arrhythmia Research Technology Inc. Common Stock
HRTG,"Heritage Insurance Holdings, Inc. Common Stock"
HSBC,"HSBC Holdings, plc. Common Stock"
HSBC$A,"HSBC Holdings, plc. ADR SER A REP 1/40 PFD SER A"
HSC,Harsco Corporation Common Stock
HSEA,"HSBC Holdings, plc. Perpetual Sub Cap Secs"
HSEB,HSBC Holdings plc PERP SUB CAP SECS EXCH PREF SHS SER 2 (United Kingdom)
HSFC$B,HSBC Finance Corp Dep. Shares reptsg 1/40 Preferred Series B
HSP,Hospira Inc
HSPX,Horizons S&P 500 Covered Call
HST,"Host Hotels & Resorts, Inc. Common Stock"
HSY,The Hershey Company Common Stock
HT,Hersha Hospitality Trust Class A Common Shares of Beneficial Interest
HT$B,Hersha Hospitality Trust PFD SER B
HT$C,Hersha Hospitality Trust 6.875% Series C Cumulative Redeemable Preferred Shares of Beneficial Interest
HTA,"Healthcare Trust of America, Inc. Class A Common Stock"
HTD,John Hancock Tax Advantaged Dividend Income Fund Common Shares of Beneficial Interest
HTF,Horizon Technology Finance Corporation 7.375% Senior Notes due 2019
HTGC,"Hercules Technology Growth Capital, Inc. Common Stock"
HTGX,"Hercules Technology Growth Capital, Inc. 6.25% Notes due 2024"
HTGY,"Hercules Technology Growth Capital, Inc. 7.00% Senior Notes due 2019"
HTGZ,"Hercules Technology Growth Capital, Inc. 7.00% Note due 2019"
HTH,Hilltop Holdings Inc.
HTM,U.S. Geothermal Inc. Common Stock
HTR,Brookfield Total Return Fund Inc. (The) Common Stock
HTS,Hatteras Financial Corp Hatteras Financial Corp  Common Stock
HTS$A,Hatteras Financial Corp Cum Redeemable Pfd Ser A
HTY,John Hancock Tax
HTZ,"Hertz Global Holdings, Inc Common Stock"
HUB.A,Hubbell Inc A Common Stock
HUB.B,Hubbell Inc Common Stock Class B
HUBS,"HubSpot, Inc. Common Stock"
HUM,Humana Inc. Common Stock
HUN,Huntsman Corporation Common Stock
HUSA,Houston American Energy Corporation Common Stock
HUSE,Huntington US Equity Rotation Strategy ETF
HUSI$D,"HSBC USA, Inc. Preferred Stock"
HUSI$F,"HSBC USA, Inc. Preferred Series F Floating Rate"
HUSI$G,"HSBC USA, Inc. Dep Shs repstg 1/40 Preferred Series G"
HUSI$H,"HSBC USA, Inc. Depositary Sh repstg 1/40th Preferred Series H"
HUSI$Z,"HSBC USA, Inc. Preferred Stock"
HVB,Hudson Valley Holding Corp. Common Stock
HVPW,U.S. Equity High Volatility Put Write Index Fund
HVT,"Haverty Furniture Companies, Inc. Common Stock"
HVT.A,"Haverty Furniture Companies, Inc. Common Stock"
HW,Headwaters Incorporated Common Stock
HXL,Hexcel Corporation Common Stock
HY,Hyster
HYB,"New America High Income Fund, Inc. (The) Common Stock"
HYD,Market Vectors High Yield Municipal Index ETF
HYEM,Market Vectors Emerging Markets High Yield Bond ETF
HYF,"Managed High Yield Plus Fund, Inc. Common Stock"
HYG,iShares iBoxx $ High Yield Corporate Bond ETF
HYGH,iShares Interest Rate Hedged High Yield Bond ETF
HYH,"Halyard Health, Inc. Common Stock"
HYHG,ProShares High Yield Interest Rate Hedged
HYI,Western Asset High Yield Defined Opportunity Fund Inc. Common Stock
HYLD,Peritus High Yield ETF
HYMB,SPDR Nuveen S&P High Yield Municipal Bond ETF
HYS,PIMCO 0
HYT,"Blackrock Corporate High Yield Fund, Inc. Common Stock"
HYXU,iShares Global ex USD High Yield Corporate Bond ETF
HZO,"MarineMax, Inc. Common Stock"
I,Intelsat S.A. Common Shares
I$A,Intelsat S.A. Series A mandatory convefrtible junior non
IAE,Voya Asia Pacific High Dividend Equity Income Fund ING Asia Pacific High Dividend Equity Income Fund Common Shares of Beneficial Interest
IAF,Aberdeen Australia Equity Fund Inc Common Stock
IAG,Iamgold Corporation Ordinary Shares
IAI,iShares U.S. Broker
IAK,iShares U.S. Insurance ETF
IAT,iShares U.S. Regional Banks ETF
IAU,ishares Gold Trust
IBA,"Industrias Bachoco, S.A.B. de C.V. Common Stock"
IBCB,iShares iBonds Mar 2016 Corporate ex
IBCC,iShares iBonds Mar 2018 Corporate ex
IBCD,iShares iBonds Mar 2020 Corporate ex
IBCE,iShares iBonds Mar Bond Corporate ex
IBDA,iShares iBonds Mar 2016 Corporate ETF
IBDB,iShares iBonds Mar 2018 Corporate ETF
IBDC,iShares iBonds Mar 2020 Corporate Term ETF
IBDD,iShares iBonds Mar 2023 Corporate Term ETF
IBDF,iShares iBonds Dec 2016 Corporate ETF
IBDH,iShares iBonds Dec 2018 Corporate Term ETF
IBDL,iShares iBonds Dec 2020 Corporate ETF
IBIO,"iBio, Inc. Common Stock"
IBLN,Direxion iBillionaire Index ETF
IBM,International Business Machines Corporation Common Stock
IBMD,iShares iBonds Sep 2015 AMT
IBME,iShares iBonds  Sep 2016 AMT
IBMF,iShares iBonds Sep 2017 AMT
IBMG,iShares iBonds Sep 2018 AMT
IBMH,iShares iBonds Sep 2019 AMT
IBMI,iShares iBonds Sep 2020 AMT
IBN,ICICI Bank Limited Common Stock
IBND,SPDR Barclays International Bond ETF
IBP,"Installed Building Products, Inc. Common Stock"
ICA,Empresas Ica Soc Contrladora Common Stock
ICB,"MS Income Securities, Inc. Common Stock"
ICD,"Independence Contract Drilling, Inc. Common Stock"
ICE,Intercontinental Exchange Inc. Common Stock
ICF,iShares Cohen & Steers REIT ETF
ICI,iPath iPath Optimized Currency Carry ETN
ICL,Israel Chemicals Limited Ordinary Shares
ICN,WisdomTree Indian Rupee Strategy Fund
ICOL,iShares MSCI Colombia Capped
ICSH,iShares Liquidity Income ETF
IDA,"IDACORP, Inc. Common Stock"
IDE,"Voya Infrastructure, Industrials and Materials Fund Common Shares of Beneficial Interest"
IDG,ING GROEP N V PREF CTF 7.3750% Perp Hybrid Cap Secs (Netherlands)
IDHB,PowerShares S&P International Developed High Beta Portfolio Exchange Traded Fund
IDHQ,PowerShares S&P International Developed High Quality Portfolio (S&P International Developed High Quality Ranking Index
IDI,"Tiger Media, Inc."
IDLV,PowerShares S&P International Developed Low Volatility Portfolio
IDN,"Intellicheck Mobilisa, Inc. Common Stock"
IDOG,ALPS International Sector Dividend Dogs ETF
IDT,IDT Corporation Class B Common Stock
IDU,iShares U.S. Utilities ETF
IDV,iShares International Select Dividend ETF
IDX,Market Vectors Indonesia Index ETF
IDXJ,Market Vectors Indonesia Small Cap ETF
IEC,IEC Electronics Corp. Common Stock
IEF,iShares 7
IEFA,iShares Core MSCI EAFE ETF
IEH,Integrys Energy Group 6.00% Junior Subordinated Notes Due 2073
IEI,iShares 3
IEIL,iShares Enhanced International Large
IEIS,iShares Enhanced International Small
IELG,iShares Enhanced U.S. Large
IEMG,iShares Core MSCI Emerging Markets ETF
IEO,iShares U.S. Oil & Gas Exploration & Production ETF
IESM,iShares Enhanced U.S. Small
IEUR,iShares Core MSCI Europe ETF
IEV,iShares Europe ETF
IEX,IDEX Corporation Common Stock
IEZ,iShares U.S. Oil Equipment & Services ETF
IF,"Aberdeen Indonesia Fund, Inc. (Common Stock"
IFF,"Internationa Flavors & Fragrances, Inc. Common Stock"
IFMI,"Institutional Financial Markets, Inc."
IFN,"India Fund, Inc. (The) Common Stock"
IFT,"Imperial Holdings, Inc. Common Stock"
IG,"IGI, Laboratories Inc. Common Stock"
IGA,Voya Global Advantage and Premium Opportunity Fund Common Shares of Beneficial Interest
IGC,India Globalization Capital Inc. Common Stock
IGC.W,India Globalization Capital Inc. Warrants
IGD,Voya Global Equity Dividend and Premium Opportunity Fund
IGE,iShares North American Natural Resources ETF
IGF,iShares Global Infrastructure ETF
IGHG,ProShares Investment Grade
IGI,Western Asset Investment Grade Defined Opportunity Trust Inc. Common Stock
IGM,iShares North American Tech ETF
IGN,iShares North American Tech
IGR,CBRE Clarion Global Real Estate Income Fund Common Stock
IGS,ProShares Short Investment Grade Corporate
IGT,International Game Technology Common Stock
IGU,ProShares Ultra Investment Grade Corporate ETF
IGV,iShares North American Tech
IHC,Independence Holding Company Common Stock
IHD,Voya Emerging Markets High Income Dividend Equity Fund Common Shares
IHDG,WisdomTree International Hedged Dividend Growth Fund
IHE,iShares U.S. Pharmaceutical ETF
IHF,iShares U.S. Health Care Providers ETF
IHG,Intercontinental Hotels Group American Depositary Shares (Each representing one Ordinary Share)
IHI,iShares U.S. Medical Devices ETF
IHS,IHS Inc. IHS Inc. Class A Common Stock
IHT,InnSuites Hospitality Trust Shares of Beneficial Interest
IHY,Market Vectors International High Yield Bond
IID,Voya International High Dividend Equity Income Fund Common Shares of Beneficial Interest
IIF,"Morgan Stanley India Investment Fund, Inc. Common Stock"
IIM,Invesco Value Municipal Income Trust Common Stock
IJH,iShares Core S&P Mid
IJJ,iShares S&P Mid
IJK,iShares S&P Mid
IJNK,SPDR Barclays International High Yield Bond ETF
IJR,iShares Core S&P Small
IJS,iShares S&P SmallCap 600 Value ETF
IJT,iShares S&P SmallCap 600 Growth ETF
IL,"IntraLinks Holdings, Inc. Common Stock $0.001 par value"
ILB,PIMCO Global Advantage Inflation Linked Bond Active Exchange
ILF,iShares Latin America 40 ETF
ILTB,iShares Core Long
IM,Ingram Micro Inc. Common Stock
IMAX,Imax Corporation Common Stock
IMH,"Impac Mortgage Holdings, Inc. Common Stock New"
IMLP,iPath S&P MLP ETN
IMN,Imation Corporation Common Stock
IMO,Imperial Oil Limited Common Stock
IMPR,"Imprivata, Inc. Common Stock"
IMPV,"Imperva, Inc. Common Stock"
IMS,"IMS Health Holdings, Inc. Common Stock"
IMUC,"ImmunoCellular Therapeutics, Ltd. Common Stock"
INB,"Cohen & Steers Global Income Builder, Inc. Common Shares of Beneficial Interest"
INCO,EG Shares India Consumer ETF
IND,"ING Group, N.V. Perpetual Debt Securities"
INDA,Ishares MSCI India ETF
INDL,Direxion Daily India Bull 3x Shares
INF,Brookfield Global Listed Infrastructure Income Fund Closed End Fund
INFL,PowerShares DB US Inflation ETN
INFU,"InfuSystems Holdings, Inc. Common Stock"
INFY,Infosys Limited American Depositary Shares
ING,"ING Group, N.V. Common Stock"
INGR,Ingredion Incorporated Common Stock
INKM,SPDR SSgA Income Allocation ETF
INN,"Summit Hotel Properties, Inc. Common Stock"
INN$A,"Summit Hotel Properties, Inc. 9.25% Series A Cumulative Redeemable Preferred Stock"
INN$B,"Summit Hotel Properties, Inc. Pfd Ser B"
INN$C,"Summit Hotel Properties, Inc. 7.125% Series C Cumulative Redeemable Preferred Stock"
INP,Barclays Bank Plc iPath ETNs linked to the MSCI India Total Return Index
INR,Market Vectors Indian Rupee/USD  ETN
INS,Intelligent Systems Corporation Common Stock
INT,World Fuel Services Corporation Common Stock
INTT,inTest Corporation Common Stock
INUV,"Inuvo, Inc New"
INVN,"InvenSense, Inc. Common Stock"
INXN,InterXion Holding N.V. Ordinary Shares (0.01 nominal value)
INXX,EGShares India Infrastructure ETF
INY,SPDR Nuveen Barclays New York Municipal Bond ETF
INZ,Ing Groep NV Perpetual Debt Securities
IO,Ion Geophysical Corporation Common Stock
IOC,InterOil Corporation
IOIL,IQ Global Oil Small Cap ETF
IOO,iShares Global 100 ETF
IOT,"Income Opportunity Realty Investors, Inc. Common Stock"
IP,International Paper Company Common Stock
IPAC,iShares Core MSCI Pacific ETF
IPB,"Merrill Lynch & Co., Inc. 6.0518% Index Plus Trust Certificates Series 2003"
IPD,SPDR S&P International Consumer Discretionary Sector ETF
IPE,SPDR Barclays TIPS ETF
IPF,SPDR S&P International Financial Sector ETF
IPFF,iShares International Preferred Stock ETF
IPG,"Interpublic Group of Companies, Inc. (The) Common Stock"
IPHI,Inphi Corporation Common Stock $0.001 par value
IPI,"Intrepid Potash, Inc Common Stock"
IPK,SPDR S&P International Technology Sector ETF
IPL$D,Interstate Power & Light Company Perp Prd Ser D
IPN,SPDR S&P International Industrial Sector ETF
IPO,Renaissance IPO ETF
IPOS,Renaissance Capital Greenwich Fund
IPS,SPDR S&P International Consumer Staples Sector ETF
IPU,SPDR S&P International Utilities Sector ETF
IPW,SPDR S&P International Energy Sector ETF
IQDE,FlexShares International Quality Dividend Defensive Index Fund
IQDF,FlexShares International Quality Dividend Index Fund
IQDY,FlexShares International Quality Dividend Dynamic Index Fund
IQI,Invesco Quality Municipal Income Trust Common Stock
IR,Ingersoll
IRC,Inland Real Estate Corporation Common Stock
IRC$A,"Inland Real Estate Corporation 8.125% Series A Cumulative Redeemable Preferred Stock, $0.01 par value"
IRC$B,Inland Real Estate Corporation Redeemable Preferred Series B
IRE,Governor and Company of the Bank of Ireland (The) Common Stock
IRET,Investors Real Estate Trust Shares of Beneficial Interest
IRET$,Investors Real Estate Trust Series A Cumulative Redeemable Preferred Shares of Beneficial Interest
IRET$B,Investors Real Estate Trust 7.95% Series B Cumulative Redeemable Preferred Shares
IRF,International Rectifier Corporation Common Stock
IRL,"New Ireland Fund, Inc (The) Common Stock"
IRM,Iron Mountain Incorporated (Delaware)Common Stock
IRR,Voya Natural Resources Equity Income Fund Common Shares of Beneficial Interest
IRS,IRSA Inversiones Y Representaciones S.A. Common Stock
IRT,"Independence Realty Trust, Inc. Common Stock"
IRV,SPDR S&P International Materials Sector ETF
IRY,SPDR S&P International Health Care Sector ETF
ISD,"Prudential Short Duration High Yield Fund, Inc. Common Stock"
ISDR,Issuer Direct Corporation Common Stock
ISF,"ING Group, N.V. Perp Hybrid Cap Secs (Netherlands)"
ISG,"ING Group, N.V. Perpetual Dent Secs 6.125%"
ISH,International Shipholding Corporation Common Stock
ISH$A,International Shipholding Corporation Cumulative Redeemable Perpetual Preferred Series A
ISH$B,International Shipholding Corporation PERP PFD SER B
ISL,"Aberdeen Israel Fund, Inc. (The) Common Stock"
ISP,ING Groep NV 6.20% Perpetual Debt Securities (Netherlands)
ISR,"IsoRay, Inc. Common Stock"
ISRA,Market Vectors Israel ETF
IST,SPDR S&P International Telecommunications Sector ETF
ISTB,iShares Core Short
IT,"Gartner, Inc. Common Stock"
ITA,iShares U.S. Aerospace & Defense ETF
ITB,iShares U.S. Home Construction ETF
ITC,ITC Holdings Corp. Common Stock
ITE,SPDR Barclays Intermediate Term Treasury ETF
ITF,iShares Japn Large
ITG,"Investment Technology Group, Inc. Common Stock"
ITI,"Iteris, Inc. Common Stock"
ITIP,iShares International Inflation
ITLT,PowerShares DB 3X Italian Treasury Bond Futures ETN
ITLY,PowerShares DB Italian Treasury Bond Futures ETN
ITM,Market Vectors Intermediate Municipal Index ETF
ITOT,iShares Core S&P Total U.S. Stock Market ETF
ITR,SPDR Barclays Intermediate Term Corporate Bond ETF (based on Barclays Capital Intermediate U.S. Corporate Index symbol LD06TRUU
ITT,ITT Corporation Common Stock New
ITUB,Itau Unibanco Banco Holding SA American Depositary Shares (Each repstg 500 Preferred shares)
ITW,Illinois Tool Works Inc. Common Stock
IUSB,iShares Core Total USD Bond Market ETF
IUSG,iShares Core U.S. Growth ETF
IUSV,iShares Core U.S. Vaue ETF
IVAL,ValueShares International Quantitative Value ETF
IVC,Invacare Corporation Common Stock
IVE,iShares S&P 500 Value ETF
IVH,Ivy High Income Opportunities Fund Common Shares of Beneficial Interest
IVOG,Vanguard S&P Mid
IVOO,Vanguard S&P Mid
IVOP,iPath Inverse S&P 500 VIX Short Term Futures
IVOV,Vanguard S&P Mid
IVR,INVESCO MORTGAGE CAPITAL INC Common Stock
IVR$A,Invesco Mortgage Capital Inc. Pfd Ser A
IVR$B,Invesco Mortgage Capital Inc. Preferred Series B Cum Fxd to Fltg
IVV,iShares Core S&P 500 ETF
IVW,iShares S&P 500 Growth ETF
IVZ,Invesco Plc New Common Stock
IWB,iShares Russell 1000 ETF
IWC,iShares Microcap ETF
IWD,iShares Russell 1000 Value ETF
IWF,iShares Russell 1000 Growth ETF
IWL,iShares Russell Top 200 ETF
IWM,iShares Russell 2000 ETF
IWN,iShares Russell 2000 Value ETF
IWO,iShares Russell 2000 Growth ETF
IWP,iShares Russell Midcap Growth ETF
IWR,iShares Russell Mid
IWS,iShares Russell Mid
IWV,iShares Russell 3000 ETF
IWX,iShares Russell Top 200 Value ETF
IWY,iShares Russell Top 200 Growth ETF
IX,Orix Corp Ads Common Stock
IXC,iShares Global Energy ETF
IXG,iShares Global Financial ETF
IXJ,iShares Global Healthcare ETF
IXN,iShares Global Tech ETF
IXP,iShares Global Telecom ETF
IXUS,iShares Core MSCI Total International Stock ETF
IYC,iShares U.S. Consumer Services ETF
IYE,iShares U.S. Energy ETF
IYF,iShares U.S. Financial ETF
IYG,iShares U.S. Financial Services ETF
IYH,iShares U.S. Healthcare ETF
IYJ,iShares U.S. Industrials ETF
IYK,iShares U.S. Consumer Goods ETF
IYLD,iShares Morningstar Multi
IYM,iShares U.S. Basic Materials ETF
IYR,iShares U.S. Real Estate ETF
IYT,iShares Transportation AverageETF
IYW,iShares U.S. Technology ETF
IYY,iShares Dow Jones U.S. ETF
IYZ,iShares U.S. Telecommunications ETF
JAH,Jarden Corporation Common Stock
JBK,Lehman ABS 3.50 3.50% Adjustable Corp Backed Tr Certs GS Cap I
JBL,"Jabil Circuit, Inc. Common Stock"
JBN,"Select Asset Inc. Select Asset Inc. on behalf of Corporate Backed Callable Trust Certificates, J.C. Penney Debenture Backed Series 2007"
JBR,"Select Asset Inc. Corporate Backed Callable Trust Certificates, J.C. Penney Debenture"
JBT,John Bean Technologies Corporation Common Stock
JCE,Nuveen Core Equity Alpha Fund Nuveen Core Equity Alpha Fund Common Shares of Beneficial Interest
JCI,"Johnson Controls, Inc. Common Stock"
JCP,"J.C. Penney Company, Inc. Holding Company Common Stock"
JDD,Nuveen Diversified Dividend and Income Fund Shares of Beneficial Interest
JDST,Direxion Daily Junior Gold Miners Index Bear 3X Shares
JE,"Just Energy Group, Inc. Ordinary Shares (Canada)"
JEC,Jacobs Engineering Group Inc. Common Stock
JEM,iPath GEMS Index ETN
JEQ,"Aberdeen Japan Equity Fund, Inc.  Common Stock"
JFC,"JPMorgan China Region  Fund, Inc. Common Stock"
JFR,Nuveen Floating Rate Income Fund Common Stock
JGBD,PowerShares DB 3X Inverse Govt Bond Futures ETN
JGBL,PowerShares DB Japanese Govt Bond Futures ETN
JGBS,PowerShares DB Inverse Japanese Govt Bond Futures ETN
JGBT,PowerShares DB 3X Japanese Govt Bond Futures ETN
JGH,Nuveen Global High Income Fund Common Shares of Beneficial Interest
JGV,Nuveen Global Equity Income Fund
JGW,J.G. Wentworth Company (The) Class A Common Stock
JHI,John Hancock Investors Trust Common Stock
JHP,Nuveen Quality Preferred Income Fund 3 Preferred Income 3
JHS,John Hancock Income Securities Trust Common Stock
JHX,James Hardie Industries plc American Depositary Shares (Ireland)
JJA,iPath Bloomberg Agriculture Total Return Sub
JJC,iPath Bloomberg Copper Subindex Total Return Sub
JJE,iPath Bloomberg Energy Total Return Sub
JJG,iPath Bloomberg Grains Total Return Sub
JJM,iPath Bloomberg Industrial Metals Total Return Sub
JJN,iPath Bloomberg Nickel Subindex Total Return ETN
JJP,iPath Bloomberg Precious Metals Subindex Total Return SM Index ETN
JJS,iPath Bloomberg Softs Subindex Total Return SM Index ETN
JJT,iPath Bloomberg Tin Subindex Total Return SM ETN
JJU,iPath Bloomberg Aluminum Subindex Total Return SM IndexETN
JKD,iShares Morningstar Large
JKE,iShares Morningstar Large
JKF,iShares Morningstar Large
JKG,iShares Morningstar Mid
JKH,iShares Morningstar Mid
JKI,iShares Morningstar Mid
JKJ,iShares Morningstar Small
JKK,iShares Morningstar Small
JKL,iShares Morningstar Small
JKS,JinkoSolar Holding Company Limited American Depositary Shares (each representing 4 Common Shares)
JLL,Jones Lang LaSalle Incorporated Common Stock
JLS,Nuveen Mortgage Opportunity Term Fund Nuveen Mortgage Opportunity Term Fund
JMEI,"Jumei International Holding Limited American Depositary Shares, each representing one Class A ordinary share"
JMF,Nuveen Energy MLP Total Return Fund Common Shares of Beneficial Interest
JMI,Javelin Mortgage Investment Corp. Common Stock
JMLP,Nuveen All Cap Energy MLP Opportunities Fund Common Shares of Beneficial Interest
JMM,Nuveen Multi
JMP,JMP Group LLC Common Shares
JMPB,JMP Group Inc 8.00% Senior Notes due 2023
JMPC,JMP Group Inc 7.25% Senior Notes due 2021
JMT,Nuveen Mortgage Opportunity Term Fund 2 Common Shares of Beneficial Interest
JNJ,Johnson & Johnson Common Stock
JNK,SPDR Barclays High Yield Bond ETF
JNPR,"Juniper Networks, Inc. Common Stock"
JNS,"Janus Capital Group, Inc. Cmn Stk"
JNUG,Direxion Daily Junior Gold Miners Index Bull 3X Shares
JO,iPath Bloomberg Coffee Subindex Total Return SM Index ETN
JOB,"General Employment Enterprises, Inc. Common Stock"
JOE,St. Joe Company (The) Common Stock
JOF,Japan Smaller Capitalization Fund Inc Common Stock
JONE,"Jones Energy, Inc. Class A Common Stock"
JOY,Joy Global Inc. Common Stock
JPC,Nuveen  Preferred Income Opportunities Fund
JPEM,JPMorgan Diversified Return Emerging Markets Equity ETF
