Symbol,Company Name
PGH,Pengrowth Energy Corporation
PGHY,PowerShares Global Short Term High Yield Bond Portfolio
PGI,"Premiere Global Services, Inc."
PGJ,PowerShares Golden Dragon China Portfolio
PGM,iPath Bloomberg Platinum Subindex Total Return SM ETN
PGN,Paragon Offshore plc Ordinary Shares
PGP,Pimco Global Stocksplus & Income Fund Pimco Global StocksPlus & Income Fund Common Shares of Beneficial Interest
PGR,Progressive Corporation (The) Common Stock
PGRE,"Paramount Group, Inc. Common Stock"
PGX,PowerShares Preferred Portfolio
PGZ,Principal Real Estate Income Fund Common Shares of Beneficial Interest
PH,Parker
PHB,PowerShares High Yield Corporate Bond Portfolio
PHD,Pioneer Floating Rate Trust Pioneer Floating Rate Trust Shares of Beneficial Interest
PHDG,PowerShares S&P 500 Downside Hedged Portfolio
PHF,"Pacholder High Yield Fund, Inc. Common Stock"
PHG,Koninklijke Philips N.V. NY Registry Shares
PHH,PHH Corp Common Stock
PHI,Philippine Long Distance Telephone Company Sponsored ADR
PHK,Pimco High Income Fund Pimco High Income Fund
PHM,"PulteGroup, Inc. Common Stock"
PHO,PowerShares Water Resource Port
PHT,Pioneer High Income Trust Common Shares of Beneficial Interest
PHX,Panhandle Oil and Gas Inc Common Stock
PHYS,Sprott Physical Gold Trust ETV
PICB,PowerShares International Corporate Bond Portfolio
PICK,iShaes MSCI Global Select Metals & Mining Producers Fund
PID,PowerShares Intl Dividend Achievers
PIE,PowerShares DWA Emerging Market Momentum Portfolio
PII,Polaris Industries Inc. Common Stock
PIM,Putnam Master Intermediate Income Trust Common Stock
PIN,PowerShares India Portfolio
PIO,PowerShares Global Water Portfolio
PIP,"PharmAthene, Inc Common Stock"
PIR,"Pier 1 Imports, Inc. Common Stock"
PIY,Preferred Plus Trust (Ser CZN) Preferred Plus Trust Ser CZN
PIZ,PowerShares DWA Developed Market Momentum Portfolio
PJC,Piper Jaffray Companies Common Stock
PJH,"Prudential Financial, Inc. 5.75% Junior Subordinated Notes due 2052"
PJP,PowerShares Dynamic Pharmaceuticals
PJS,PreferredPlus Trust Ser FAR 1 Tr Ctf
PKB,PowerShares Dynamic Build & Construction
PKD,Parker Drilling Company Common Stock
PKE,Park Electrochemical Corporation Common Stock
PKG,Packaging Corporation of America Common Stock
PKI,"PerkinElmer, Inc. Common Stock"
PKO,Pimco Income Opportunity Fund Common Shares of Beneficial Interest
PKW,PowerShares Buyback Achievers
PKX,POSCO Common Stock
PKY,"Parkway Properties, Inc. Common Stock"
PL,Protective Life Corporation Common Stock
PL$B,Protective Life Corporation PLC Capital Trust V Trust Originated Preferred Securities (TOPRS)
PL$C,Protective Life Corporation 6.25% Subordinated Debentures due 2042
PL$E,Protective Life Corporation 6.00% Subordinated Debentures due 2042
PLD,"ProLogis, Inc. Common Stock"
PLG,Platinum Group Metals Ltd. Ordinary Shares (Canada)
PLL,Pall Corporation Common Stock
PLM,Polymet Mining Corporation Ordinary Shares (Canada)
PLND,Market Vectors Poland ETF
PLOW,"Douglas Dynamics, Inc. Common Stock"
PLT,"Plantronics, Inc. Common Stock"
PLW,PowerShares 1
PLX,"Protalix BioTherapeutics, Inc. Common Stock"
PM,Philip Morris International Inc Common Stock
PMC,Pharmerica Corporation Common Stock
PMF,PIMCO Municipal Income Fund Common Stock
PML,Pimco Municipal Income Fund II Common Shares of Beneficial Interest
PMM,Putnam Managed Municipal Income Trust Common Stock
PMO,Putnam Municipal Opportunities Trust Common Stock
PMR,PowerShares Dynamic Retail
PMT,PennyMac Mortgage Investment Trust Common Shares of Beneficial Interest
PMX,PIMCO Municipal Income Fund III Common Shares of Beneficial Interest
PNC,"PNC Financial Services Group, Inc. (The) Common Stock"
PNC$P,"PNC Financial Services Group, Inc. (The) Depositary Shares Representing 1/4000th Perpetual Preferred Series P"
PNC$Q,"PNC Financial Services Group, Inc. (The) Depositary Shares Representing 1/4000th Perpetual Preferred Shares Series Q"
PNC.W,"PNC Financial Services Group, Inc. Warrant expiring December 31, 2018"
PNF,PIMCO New York Municipal Income Fund Common Stock
PNI,Pimco New York Municipal Income Fund II Common Shares of Beneficial Interest
PNK,"Pinnacle Entertainment, Inc. Common Stock"
PNM,"PNM Resources, Inc. (Holding Co.) Common Stock"
PNR,Pentair plc. Ordinary Share
PNTA,PennantPark Investment Corporation 6.25% Senior Notes due 2025
PNW,Pinnacle West Capital Corporation Common Stock
PNX,"Phoenix Companies, Inc. (The) Common Stock"
PNY,"Piedmont Natural Gas Company, Inc. Common Stock"
POL,PolyOne Corporation Common Stock
POM,"PEPCO Holdings, Inc Common Stock"
POR,Portland General Electric Co Common Stock
POST,"Post Holdings, Inc. Common Stock"
POT,Potash Corporation of Saskatchewan Inc. Common Stock
POWR,"PowerSecure International, Inc. Common Stock"
PPA,PowerShares Aerospace & Defense
PPG,"PPG Industries, Inc. Common Stock"
PPH,Market Vectors Pharmaceutical ETF
PPL,PP&L Corporation Common Stock
PPLT,ETFS Physical Platinum Shares
PPO,Polypore International Inc Common Stock
PPP,Primero Mining Corp.  New Common Shares (Canada)
PPR,Voya Prime Rate Trust Shares of Beneficial Interest
PPS,"Post Properties, Inc. Common Stock"
PPS$A,"Post Properties, Inc. Preferred Stock"
PPT,Putnam Premier Income Trust Common Stock
PPX,"PPL Capital Funding, Inc. 2013 Series B Junior Subordinated Notes due 2073"
PQ,Petroquest Energy Inc Common Stock
PRA,ProAssurance Corporation Common Stock
PRB,Market Vectors Pre
PRE,PartnerRe Ltd. Common Stock
PRE$D,PartnerRe Ltd. Preferred Series D 6.5% (Bermuda)
PRE$E,PartnerRe Ltd. PFD SER E (Bermuda)
PRE$F,PartnerRe Ltd. Redeemable Preferred Shares Series F (Bermuda)
PRF,Powershares FTSE RAFI US 1000 Portfolio
PRGO,Perrigo Company plc Ordinary Shares
PRH,"Prudential Financial, Inc. 5.70% Junior Subordinated Notes due 2053"
PRI,"Primerica, Inc. Common Stock"
PRK,Park National Corporation Common Stock
PRLB,"Proto Labs, Inc. Common stock"
PRN,PowerShares DWA Industrials Momentum Portfolio
PRO,"PROS Holdings, Inc. Common Stock"
PRU,"Prudential Financial, Inc. Common Stock"
PRY,Prospect Capital Corporation 6.95% Senior Notes due 2022
PSA,Public Storage Common Stock
PSA$A,"Public Storage Depositary Shares each representing 1/1,000 of a 5.875% Cumulative Preferred SBI, Series A"
PSA$O,Public Storage Depositary Shares Representing 1/1000% Cumulative Pfd Sh Ben Int Series O
PSA$P,Public Storage DEPOSITARY SHS REPSTG % CUMULATIVE PFD SHS BEN INT (SER P)
PSA$Q,Public Storage DEPOSITARY SHS REPSTG 1/1000TH PFD SHS BEN INT SER Q
PSA$R,Public Storage Depository Sh Repstg 1/1000th Pfd Ser R
PSA$S,Public Storage DEP SH REPSTG PFD SH BEN INT SER S
PSA$T,Public Storage Depository Shares Representing 1/1000 Pfd Shares Beneficial Interest Series T
PSA$U,Public Storage Depositary Shares Representing 1/1000 Preferred Benerficial Interest Series U
PSA$V,Public Storage Dep Shs Repstg 1/1000th Pfd Sh Ben Int Ser V
PSA$W,Public Storage Depositary Shares Representing 1/1000 Preferred Shares of Benficial Interest Series W
PSA$X,Public Storage Depositary Shares Representing 1/1000th Cumulative Preferred Shares Beneficial Interest Series X
PSA$Y,Public Storage Dep Shs Repstg 1/1000th Pfd Sh Ben Int Ser Y
PSA$Z,Public Storage Dep Shs Representing 1/1000th Pfd Sh Ben Int Ser Z
PSB,"PS Business Parks, Inc. Common Stock"
PSB$R,"PS Business Parks, Inc. Depositary Shares, Each representing 1/1,000 of a share of 6.875% Cumulative Preferred stock, Series R, $0.01 par"
PSB$S,"PS Business Parks, Inc. Depositary Shares, each representing 1/1,000 of a share of 6.45% Cumulative Preferred Stock"
PSB$T,"PS Business Parks, Inc. Depositary Shares Representing 1/1000th Preferred Series T"
PSB$U,"PS Business Parks, Inc. Dep Shs Repstg 1/1000 Pfd Ser U"
PSB$V,"PS Business Parks, Inc. Depositary Shares Represting 1/1000th Shares Cumulative Preferred Stock Series V"
PSF,"Cohen & Steers Select Preferred and Income Fund, Inc. Common Stock"
PSG,Performance Sports Group Ltd. Ordinary Shares (Canada)
PSI,PowerShares Dynamic Semiconductors
PSJ,PowerShares Dynamic Software
PSK,SPDR Wells Fargo Preferred Stock ETF
PSL,PowerShares DWA Consumer Staples Momentum Portfolio
PSLV,Sprott Physical Silver Trust ETV
PSO,"Pearson, Plc Common Stock"
PSP,PowerShares Listed Private Equity
PSQ,ProShares Short QQQ
PSR,PowerShares Active U.S. Real Estate Fund
PST,ProShares UltraShort Lehman 7
PSX,Phillips 66 Common Stock
PSXP,Phillips 66 Partners LP Common Units representing limited partner interest in the Partnership
PT,"Portugal Telecom SGPS, S.A . Common Stock"
PTF,PowerShares DWA Technology Momentum Portfolio
PTH,PowerShares DWA Healthcare Momentum Portfolio
PTM,E
PTN,"Palatin Technologies, Inc. Common Stock"
PTP,"Platinum Underwriters Holdings, Ltd"
PTR,PetroChina Company Limited Common Stock
PTY,Pimco Corporate & Income Opportunity Fund
PUI,PowerShares DWA Utilities Momentum Portfolio
PUK,Prudential Public Limited Company Common Stock
PUK$,Prudential Public Limited Company 6.75% Perpetual Subordinated Captial Security
PUK$A,Prudential Public Limited Company 6.50% Perpetual Subordinated Capital Securities Exchangeable at the Issuer's Option Into Non
PUW,PowerShares WilderHill Progressive Energy Portfolio
PVA,Penn Virginia Corporation Common Stock
PVCT,"Provectus Biopharmaceuticals, Inc."
PVG,"Pretium Resources, Inc. Ordinary Shares (Canada)"
PVH,PVH Corp. Common Stock
PVI,PowerShares VRDO Tax Free Weekly Portfolio
PVTD,"PrivateBancorp, Inc. 7.125% Subordinated Debentures due 2042"
PW,Power REIT (MD) Common Stock
PW$A,Power REIT 7.75% Series A Cumulative Perpetual Preferred Stock
PWB,PowerShares Dynamic LargeCap Growth
PWC,PowerShares XTF: Dynamic Market Portfolio
PWE,Penn West Petroleum Ltd
PWR,"Quanta Services, Inc. Common Stock"
PWV,PowerShares Dynamic LargeCap Value
PWZ,PowerShares California AMT
PX,"Praxair, Inc. Common Stock"
PXD,Pioneer Natural Resources Company Common Stock
PXE,PowerShares Dynamic Energy E&P
PXF,PowerShares FTSE RAFI Developed Markets ex
PXH,PowerShares FTSE RAFI Emerging Markets Portfolio
PXI,PowerShares DWA Energy Momentum Portfolio
PXJ,PowerShares Dynamic Oil Services
PXLC,PowerShares Fundamental Pure Large Core Portfolio
PXLG,PowerShares Fundamental Pure Large Growth Portfolio
PXLV,PowerShares Fundamental Pure Large Value Portfolio
PXMC,PowerShares Fundamental Pure Mid Core Portfolio
PXMG,PowerShares Fundamental Pure Mid Growth Portfolio
PXMV,PowerShares Fundamental Pure Mid Value Portfolio
PXQ,PowerShares Dynamic Networking
PXR,PowerShares Global Emerging Markets Infrastructure
PXSC,PowerShares Fundamental Pure Small Core Portfolio
PXSG,PowerShares Fundamental Pure Small Growth Portfolio
PXSV,PowerShares Fundamental Pure Small Value Portfolio
PYB,PPlus Trust Series GSG
PYN,PIMCO New York Municipal Income Fund III Common Shares of Beneficial Interest
PYS,Merrill Lynch Depositor Inc PPlus Tr Ser RRD
PYT,PPlus Tr GSC
PYZ,PowerShares DWA Basic Materials Momentum Portfolio
PZA,PowerShares National AMT
PZB,"Merrill Lynch Depositor, Inc. Merrill Lynch Depositor, Inc. PPLUS Class A 6.7% Callable Trust Certificates, Series LTD"
PZC,PIMCO California Municipal Income Fund III Common Shares of Beneficial Interest
PZD,PowerShares Cleantech Portfolio
PZE,Petrobras Argentina S.A. ADS
PZG,Paramount Gold and Silver Corp. Common Stock
PZI,PowerShares Zacks Micro Cap
PZN,Pzena Investment Management Inc Class A Common Stock
PZT,PowerShares New York AMT
Q,Quintiles Transnational Holdings Inc. Common Stock
QAI,IQ Hedge MultiIQ Hedge Multi
QAUS,SPDR MSCI Australia Quality Mix ETF
QCAN,SPDR MSCI Canada Quality Mix ETF
QDEF,FlexShares Quality Dividend Defensive Index Fund
QDEM,Market Vectors MSCI Emerging Markets Quality Dividend ETF
QDEU,SPDR MSCI Germany Quality Mix ETF
QDF,FlexShares Quality Dividend Index Fund
QDXU,Market Vectors MSCI International Quality Dividend ETF
QDYN,FlexShares Quality Dynamic Index Fund
QEFA,SPDR EURO STOXX Small Cap ETF
QEH,AdvisorShares QAM Equity Hedge
QEM,Market Vectors MSCI Emerging Markets Quality ETF
QEMM,SPDR MSCI Emerging Markets Quality Mix ETF
QEP,"QEP Resources, Inc. Common Stock"
QEPM,"QEP Midstream Partners, LP Common Units representing Limited Partner Interests"
QESP,SPDR MSCI Spain Quality Mix ETF
QGBR,SPDR MSCI United Kingdom Quality Mix ETF
QID,ProShares UltraShort QQQ
QIHU,"Qihoo 360 Technology Co. Ltd. American Depositary Shares, every 2 of which representing three Class A Ordinary Shares"
QJPN,SPDR MSCI Japan Quality Mix ETF
QKOR,SPDR MSCI South Korea Quality Mix ETF
QLD,ProShares Ultra QQQ
QLTA,iShares Aaa A Rated Corporate Bond ETF
QLTB,iShares Baa Ba Rated Corporate Bond ETF
QLTC,iShares B Ca Rated Corporate Bond ETF
QMEX,SPDR MSCI Mexico Quality Mix ETF
QMN,IQ Hedge Market Neutral Tracker ETF
QQQE,Direxion NASDAQ
QRM,Quest Rare Minerals Ltd Common Shares (Canada)
QSR,Restaurant Brands International Inc. Common Shares
QTM,Quantum Corporation Common Stock
QTS,"QTS Realty Trust, Inc. Class A Common Stock"
QTWN,SPDR MSCI Taiwan Quality Mix ETF
QTWO,"Q2 Holdings, Inc. Common Stock"
QUAD,"Quad Graphics, Inc Class A Common Stock"
QUAL,iShares MSCI USA Quality Factor ETF
QVAL,ValueShares U.S. Quantitative Value ETF ETF
QWLD,SPDR MSCI World Quality Mix ETF
QXUS,Market Vectors MSCI Int'l Qlty
R,"Ryder System, Inc. Common Stock"
RAD,Rite Aid Corporation Common Stock
RAI,Reynolds American Inc Common Stock
RALS,ProShares RAFI Long Short ETF
RALY,Rally Software Development Corp. Common Stock
RAS,RAIT Financial Trust New Common Shares of Beneficial Interest
RAS$A,RAIT Financial Trust  7.75% Series A Cumulative Redeemable Preferred Shares of Beneficial Interest
RAS$B,RAIT Financial Trust 8.375% Series B Cumulative Redeemable Preferred Shares of Beneficial Interest
RAS$C,RAIT Financial Trust 8.875% Series C Cumulative Redeemable Preferred Shares of Beneficial Interest
RATE,"Bankrate, Inc. Common Stock"
RAVI,FlexShares Ready Access Variable Income Fund
RAX,"Rackspace Hosting, Inc Common Stock"
RBA,Ritchie Bros. Auctioneers Incorporated Common Stock
RBC,Regal Beloit Corporation Common Stock
RBL,SPDR S&P Russia ETF
RBS,Royal Bank of Scotland Group Plc New (The) ADS
RBS$E,RBS Capital Funding Trust V
RBS$F,Royal Bank of Scotland Group Plc (The) Preferred Stock
RBS$G,RBS Capital Funding Trust VII
RBS$H,Royal Bank of Scotland Group Plc (The) Preferred Stock
RBS$I,RBS Capital Funding Trust VI
RBS$L,Royal Bank of Scotland Group Plc (The) ADR representing One Non
RBS$M,Royal Bank of Scotland Group Plc (The) ADS Series M
RBS$N,Royal Bank of Scotland Group Plc (The) Royal Bank of Scotland Group PLC (The) American Depositary Shares (each representing One Non
RBS$P,Royal Bank of Scotland Group Plc (The) ADR representing Preferred Shares Series P
RBS$Q,Royal Bank of Scotland Group Plc (The) ADR repstg Pref Shs Ser Q
RBS$R,Royal Bank of Scotland Group Plc (The) ADR repstg USD Pfd Shs Ser R (United Kingdom)
RBS$S,Royal Bank of Scotland Group Plc (The) Sponsored ADR Repstg Pref Ser S (United Kingdom)
RBS$T,Royal Bank of Scotland Group Plc (The) Sponsored ADR Representing Pfef shs ser T (United Kingdom)
RBY,Rubicon Minerals Corporation Ordinary Shares (Canada)
RCAP,RCS CAPITAL CORPORATION Common Stock
RCD,Guggenheim S&P 500 Equal Weight Consumer Discretionary ETF
RCG,"RENN Fund, Inc Common Stock"
RCI,"Rogers Communication, Inc. Common Stock"
RCL,Royal Caribbean Cruises Ltd. Common Stock
RCS,"PIMCO Strategic Income Fund, Inc."
RDC,Rowan Companies plc Class A Ordinary Shares
RDIV,RevenueShares Ultra Dividend Fund
RDN,Radian Group Inc. Common Stock
RDS.A,Royal Dutch Shell PLC Royal Dutch Shell American Depositary Shares (Each representing two Class A Ordinary Shares)
RDS.B,Royal Dutch Shell PLC Royal Dutch Shell PLC American Depositary Shares (Each representing two Class B Ordinary Shares)
RDY,Dr. Reddy's Laboratories Ltd Common Stock
RE,"Everest Re Group, Ltd. Common Stock"
REE,Rare Element Resources Ltd. Ordinary Shares (Canada)
REED,"Reeds, Inc. Common Stock"
REET,iShares Trust iShares Global REIT ETF
REG,Regency Centers Corporation Common Stock
REG$F,Regency Centers Corporation Cumulative Red Preferred Series 6%
REG$G,Regency Centers Corporation Pfd Ser 7%
REI,"Ring Energy, Inc. Common Stock"
REK,ProShares Short Real Estate
REM,iShares Mortgage Real Estate Capped ETF
REMX,Market Vectors Rare Earth Strategic Metals ETF
REN,Resolute Energy Corporation Comon Stock
RENN,"Renren Inc. American Depositary Shares, each representing three Class A ordinary shares"
RES,"RPC, Inc. Common Stock"
RESI,Altisource Residential Corporation Common Stock
RETL,Direxion Daily Retail Bull 3X Shares ETF
REV,"Revlon, Inc. New Common Stock"
REW,ProShares UltraShort Technology
REX,REX American Resources Corporation
REXR,"Rexford Industrial Realty, Inc. Common Stock"
REZ,iShares Residential Real Estate Capped ETF
RF,Regions Financial Corporation Common Stock
RF$A,Regions Financial Corporation Depositary Shares Representing 1/40th Perpetual Preferred Series A
RF$B,Regions Financial Corporation Depositary Shares Representing 1/40th Perpetual Preferred Series B
RFG,Guggenheim S&P Midcap 400 Pure Growth ETF
RFI,"Cohen & Steers Total Return Realty Fund, Inc. Common Stock"
RFP,Resolute Forest Products Inc. Common Stock
RFT,RAIT Financial Trust 7.625% Senior Notes due 2024
RFTA,RAIT Financial Trust 7.125% Senior Notes due 2019
RFV,Guggenheim S&P Midcap 400 Pure Value ETF
RGA,"Reinsurance Group of America, Incorporated Common Stock"
RGC,Regal Entertainment Group Class A Common Stock
RGI,Guggenheim S&P 500 Equal Weight Industrials ETF
RGP,Regency Energy Partners LP Common Units Representing Limited Partner Interests
RGR,"Sturm, Ruger & Company, Inc. Common Stock"
RGRA,RBS Rogers Enhanced Agriculture ETN
RGRC,RBS Rogers Enhanced Commodity ETN
RGRE,RBS Rogers Enhanced Energy ETN
RGRI,RBS Rogers Enhanced Industrial Metals ETN
RGRP,RBS Rogers Enhanced Precious Metals ETN
RGS,Regis Corporation Common Stock
RGT,"Royce Global Value Trust, Inc. Common Stock"
RH,Restoration Hardware Holdings Inc. Common Stock
RHI,Robert Half International Inc. Common Stock
RHP,"Ryman Hospitality Properties, Inc. (REIT)"
RHS,Guggenheim S&P 500 Equal Weight Consumer Staples ETF
RHT,"Red Hat, Inc. Common Stock"
RIC,"Richmont Mines, Inc. Common Stock"
RICE,Rice Energy Inc. Common Stock
RIF,RMR Real Estate Income Fund Common Shares of Beneficial Interest
RIG,Transocean Ltd (Switzerland) Common Stock
RIGP,Transocean Partners LLC Common Units Representing Limited Liability Company Interests
RIGS,RiverFront Strategic Income Fund
RINF,ProShares 30 Year TIPS TYS Spread
RING,iShares MSCI Global Gold Miners Fund
RIO,Rio Tinto Plc Common Stock
RIOM,Rio Alto Mining Limited Common Shares (Canada)
RIT,LMP Real Estate Income Fund Inc Common Stock
RJA,AB Svensk Ekportkredit (Swedish Export Credit Corporation) ELEMENTS Linked to the Rogers International Commodity Index
RJD,"Raymond James Financial, Inc. 6.90% Senior Notes Due 2042"
RJF,"Raymond James Financial, Inc. Common Stock"
RJI,AB Svensk Ekportkredit (Swedish Export Credit Corporation) ELEMENTS Linked to the Rogers International Commodity Index
RJN,AB Svensk Ekportkredit (Swedish Export Credit Corporation) ELEMENTS Linked to the Rogers International Commodity Index
RJZ,AB Svensk Ekportkredit (Swedish Export Credit Corporation) ELEMENTS Linked to the Rogers International Commodity Index
RKT,Rock
RKUS,"Ruckus Wireless, Inc. Common Stock"
RL,Ralph Lauren Corporation Common Stock
RLD,RealD Inc Common Stock
RLGT,"Radiant Logistics, Inc. Common Stock"
RLGT$A,"Radiant Logistics, Inc. 9.75% Series A Cumulative Redeemable Perpetual Preferred Stock"
RLGY,Realogy Holdings Corp. Common Stock
RLH,Red Lions Hotels Corporation Common Stock
RLH$A,Red Lion Hotels Capital Trust Red Lion Hotels Capital Trust
RLI,RLI Corp. Common Stock
RLJ,RLJ Lodging Trust Common Shares of Beneficial Interest $0.01 par value
RLY,SPDR SSgA Multi Asset Real Return ETF
RM,Regional Management Corp. Common Stock
RMAX,"RE/MAX Holdings, Inc. Class A Common Stock"
RMD,ResMed Inc. Common Stock
RMP,Rice Midstream Partners LP Common Units representing limited partner interests
RMT,Royce Micro
RNDY,"Roundy's, Inc. Common Stock"
RNE,"Morgan Stanley Eastern Europe Fund, Inc. Common Stock"
RNF,"Rentech Nitrogen Partners, L.P. Common Units representing limited partner interests"
RNG,"Ringcentral, Inc. Class A Common Stock"
RNN,"Rexahn Pharmaceuticals, Inc. Common Stock"
RNO,Rhino Resource Partners LP Common Units representing limited partnership interests
RNP,Cohen & Steers Reit and Preferred Income Fund Inc Common Shares
RNR,RenaissanceRe Holdings Ltd. Common Stock
RNR$C,RenaissanceRe Holdings Ltd. 6.08% Series C Preference Shares
RNR$E,RenaissanceRe Holdings Ltd. 5.375% Series E Preference Shares
ROC,"Rockwood Holdings, Inc. Common Stock"
RODI,Barclays Return on Disability ETN
ROG,Rogers Corporation Common Stock
ROK,"Rockwell Automation, Inc. Common Stock"
ROL,"Rollins, Inc. Common Stock"
ROLA,iPath Long Extended Russell 1000 TR Index ETN
ROM,ProShares Ultra Technology
ROOF,IQ US Real Estate Small Cap ETF
ROP,"Roper Industries, Inc. Common Stock"
RORO,SPDR SSgA Risk Aware ETF
ROX,"Castle Brands, Inc. Castle Brands, Inc. Common Stock"
ROYT,Pacific Coast Oil Trust Units of Beneficial Interest
RPAI,"Retail Properties of America, Inc. Class A Common Stock"
RPAI$A,"Retail Properties of America, Inc. Pfd Ser A %"
RPG,Guggenheim S&P 500 Pure Growth ETF
RPI,"Roberts Realty Investors, Inc. Common Stock"
RPM,RPM International Inc. Common Stock
RPT,Ramco
RPT$D,Ramco
RPV,Guggenheim S&P 500 Pure Value ETF
RPX,Columbia Large Cap Growth ETF
RQI,Cohen & Steers Quality Income Realty Fund Inc Common Shares
RRC,Range Resources Corporation Common Stock
RRF,WisdomTree Global Real Return Fund
RRMS,"Rose Rock Midstream, L.P. Common Units Representing Limited Partner Interests"
RRTS,"Roadrunner Transportation Systems, Inc Common Stock"
RS,Reliance Steel & Aluminum Co. Common Stock
RSCO,SPDR Russell Small Cap Completeness ETF
RSE,"Rouse Properties, Inc. Common Stock"
RSG,"Republic Services, Inc. Common Stock"
RSH,Radioshack Corporation Common Stock
RSO,Resource Capital Corp. Resource Capital Corp. Common Stock
RSO$A,Resource Capital Corp. 8.50% Series A Cumulative Redeemable Preferred Stock
RSO$B,Resource Capital Corp. Pfd Ser B
RSO$C,Resource Capital Corp. Preferred Series C
RSP,Guggenheim S&P 500 Equal Weight ETF
RSPP,"RSP Permian, Inc. Common Stock"
RST,"Rosetta Stone Rosetta Stone, Inc."
RSX,Market Vectors TR Russia ETF
RSXJ,Market Vectors Russia Small
RT,"Ruby Tuesday, Inc. Common Stock"
RTEC,"Rudolph Technologies, Inc. Common Stock"
RTH,Market Vectors Retail ETF
RTI,"RTI International Metals, Inc. Common Stock"
RTLA,iPath Long Extended Russell 2000 TR Index ETN
RTM,Guggenheim S&P 500 Equal Weight Materials ETF
RTN,Raytheon Company Common Stock
RTR,RevenueShares ADR
RUBI,"The Rubicon Project, Inc. Common Stock"
RUK,Reed Elsevier NV PLC New ADS
RUSL,Direxion Daily Russia Bull 3x Shares
RUSS,Direxion Daily Russia Bear 3x Shares
RVM,"Revett Mining Company, Inc. (DE)"
RVNU,Deutsche X
RVP,"Retractable Technologies, Inc. Common Stock"
RVT,"Royce Value Trust, Inc. Common Stock"
RWC,RELM Wireless Corporation Common Stock
RWG,Columbia  Select Large Cap Growth ETF
RWJ,RevenueShares Small Cap
RWK,RevenueShares Mid Cap
RWL,RevenueShares Large Cap
RWM,ProShares Short Russell2000
RWO,SPDR DJ Wilshire Global Real Estate ETF
RWR,SPDR DJ Wilshire REIT ETF
RWT,"Redwood Trust, Inc. Common Stock"
RWV,RevenueShares Navallier Overall A
RWW,RevenueShares Financials Sector
RWX,SPDR DJ Wilshire Intl Real Estate
RWXL,ETRACS Monthly Pay 2XLeveraged Dow Jones International Real Estate ETN
RXD,ProShares UltraShort Health Care
RXI,iShares Global Consumer Discretionary ETF
RXL,ProShares Ultra Health Care
RXN,Rexnord Corporation Common Stock
RY,Royal Bank Of Canada Common Stock
RYAM,Rayonier Advanced Materials Inc. Common Stock
RYE,Guggenheim S&P 500 Equal Weight Energy ETF
RYF,Guggenheim S&P 500 Equal Weight Financials ETF
RYH,Guggenheim S&P 500 Equal Weight Healthcare ETF
RYI,Ryerson Holding Corporation Common Stock
RYJ,Guggenheim Raymond James SB
RYL,"Ryland Group, Inc. (The) Common Stock"
RYN,Rayonier Inc. REIT Common Stock
RYT,Guggenheim S&P 500 Equal Weight Technology ETF
RYU,Guggenheim S&P 500 Equal Weight Utilities ETF
RZA,"Reinsurance Group of America, Incorporated 6.20% Fixed"
RZG,Guggenheim S&P Smallcap 600 Pure Growth ETF
RZV,Guggenheim S&P Smallcap 600 Pure Value ETF
S,Sprint Corporation Common Stock
SA,"Seabridge Gold, Inc. Ordinary Shares (Canada)"
SAA,ProShares Ultra SmallCap600
SAGG,Direxion Daily Total Bond Market Bear 1X Shares
SAH,"Sonic Automotive, Inc. Common Stock"
SAIC,SCIENCE APPLICATIONS INTERNATIONAL CORPORATION Common Stock
SALT,Scorpio Bulkers Inc. Common Stock
SAM,"Boston Beer Company, Inc. (The) Common Stock"
SAN,"Banco Santander, S.A. Sponsored ADR (Spain)"
SAN$A,"Banco Santander, S.A. 6.80% Non"
SAN$B,Santander Finance Preferred SA Unipersonal Floating Rate Non
SAN$C,"Banco Santander, S.A. 6.50% Non"
SAN$I,"Banco Santander Central Hispano, S.A. Santander Finance Preferred S.A. Unipersonal 6.41% Non"
SAND,Sandstorm Gold Ltd. Ordinary Shares (Canada)
SAP,SAP  SE ADS
SAQ,Saratoga Investment Corp 7.50% Notes due 2020
SAR,Saratoga Investment Corp New
SARA,"Saratoga Resources, Inc. Common Stock"
SB,"Safe Bulkers, Inc Common Stock ($0.001 par value)"
SB$B,"Safe Bulkers, Inc 8.00% Series B Cumulative Redeemable Perpetual Preferred Shares"
SB$C,"Safe Bulkers, Inc Cumulative Redeemable Perpetual Preferred Series C (Marshall Islands)"
SB$D,"Safe Bulkers, Inc Perpetual Preferred Series D (Marshall Islands)"
SBB,ProShares Short SmallCap600
SBGL,Sibanye Gold Limited American Depositary Shares (Each representing four ordinary shares)
SBH,"Sally Beauty Holdings, Inc. (Name to be changed from Sally Holdings, Inc.) Common Stock"
SBI,Western Asset Intermediate Muni Fund Inc Common Stock
SBIO,ALPS Medical Breakthroughs ETF
SBM,Short Basic Materials
SBNA,Scorpio Tankers Inc. 6.75% Senior Notes due 2020
SBNB,Scorpio Tankers Inc. 7.50% Senior Notes Due 2017
SBND,PowerShares DB 3X Short 25 Year Treasury Bond ETN
SBR,Sabine Royalty Trust Common Stock
